{
  "$schema": "../card-effect-family.schema.json",
  "schemaVersion": 1,
  "rulesVersion": "v2.3",
  "rulesRevision": "v2.3-r5",
  "family": "Starter",
  "description": "Canonical structured effects for the Core Starter family.",
  "cards": {
    "DDB-STA-CORE-001": {
      "name": "Bad Habit",
      "effects": []
    },
    "DDB-STA-CORE-002": {
      "name": "Basic Body Kick",
      "effects": []
    },
    "DDB-STA-CORE-003": {
      "name": "Basic Jab",
      "effects": []
    },
    "DDB-STA-CORE-004": {
      "name": "Basic Shin Kick",
      "effects": []
    },
    "DDB-STA-CORE-005": {
      "name": "Breathing Drill",
      "effects": [
        {
          "id": "starter-breathing-drill-next-attack",
          "effect": "combat.modifyAttackPower",
          "trigger": "onPlay",
          "target": "self",
          "amount": 1,
          "duration": "nextAttack"
        }
      ]
    },
    "DDB-STA-CORE-006": {
      "name": "Center Guard",
      "effects": []
    },
    "DDB-STA-CORE-007": {
      "name": "Cover Up",
      "effects": []
    },
    "DDB-STA-CORE-008": {
      "name": "Footwork Drill",
      "effects": [
        {
          "id": "starter-footwork-speed",
          "effect": "combat.modifySpeed",
          "trigger": "onPlay",
          "target": "self",
          "amount": 2,
          "duration": "endOfRound"
        },
        {
          "id": "starter-footwork-fastest-focus",
          "effect": "core.gainFocus",
          "trigger": "onPlay",
          "target": "self",
          "amount": 1,
          "duration": "immediate",
          "conditions": [
            {
              "kind": "isFastest",
              "operator": "eq",
              "value": true
            }
          ],
          "resolver": "starter.gainFocusIfFastest"
        }
      ]
    },
    "DDB-STA-CORE-009": {
      "name": "High Guard",
      "effects": []
    },
    "DDB-STA-CORE-010": {
      "name": "Low Guard",
      "effects": []
    },
    "DDB-STA-CORE-011": {
      "name": "Wild Swing",
      "effects": [
        {
          "id": "starter-wild-swing-zone",
          "effect": "combat.chooseZone",
          "trigger": "onAttackDeclared",
          "target": "source",
          "resolver": "attack.chooseAnyZone"
        }
      ]
    }
  }
}
